{
  "schema_version": "1.0",
  "layer_name": "Cognitive Operating Layer",
  "normative_status": "non_normative_support_layer",
  "visibility": "standard_agent_behavior",
  "source_attribution_in_outputs": false,
  "precedence": "below_approved_spec_company_customer_rules_and_human_approvals",
  "assignment_count": 90,
  "assignments": [
    {
      "agent_id": "C01",
      "agent_class": "control",
      "modules": [
        "COM-01",
        "COM-02",
        "COM-08",
        "COM-09",
        "COM-10"
      ],
      "operating_mode": "evidence_first",
      "mandatory_gates": [
        "direct_spec_citation",
        "source_integrity",
        "human_review_for_authority"
      ]
    },
    {
      "agent_id": "C02",
      "agent_class": "control",
      "modules": [
        "COM-01",
        "COM-02",
        "COM-05",
        "COM-08"
      ],
      "operating_mode": "evidence_first",
      "mandatory_gates": [
        "direct_spec_citation",
        "source_integrity",
        "human_review_for_authority"
      ]
    },
    {
      "agent_id": "C03",
      "agent_class": "control",
      "modules": [
        "COM-01",
        "COM-02",
        "COM-08",
        "COM-09"
      ],
      "operating_mode": "evidence_first",
      "mandatory_gates": [
        "direct_spec_citation",
        "source_integrity",
        "human_review_for_authority"
      ]
    },
    {
      "agent_id": "C04",
      "agent_class": "control",
      "modules": [
        "COM-01",
        "COM-02",
        "COM-05",
        "COM-08"
      ],
      "operating_mode": "evidence_first",
      "mandatory_gates": [
        "direct_spec_citation",
        "source_integrity",
        "human_review_for_authority"
      ]
    },
    {
      "agent_id": "C05",
      "agent_class": "control",
      "modules": [
        "COM-01",
        "COM-02",
        "COM-04",
        "COM-05",
        "COM-06",
        "COM-09",
        "COM-10"
      ],
      "operating_mode": "evidence_first",
      "mandatory_gates": [
        "direct_spec_citation",
        "source_integrity",
        "human_review_for_authority"
      ]
    },
    {
      "agent_id": "C06",
      "agent_class": "control",
      "modules": [
        "COM-01",
        "COM-02",
        "COM-03",
        "COM-05",
        "COM-07",
        "COM-09",
        "COM-10"
      ],
      "operating_mode": "evidence_first",
      "mandatory_gates": [
        "direct_spec_citation",
        "source_integrity",
        "human_review_for_authority"
      ]
    },
    {
      "agent_id": "C07",
      "agent_class": "control",
      "modules": [
        "COM-02",
        "COM-03",
        "COM-04",
        "COM-05",
        "COM-09",
        "COM-10"
      ],
      "operating_mode": "evidence_first",
      "mandatory_gates": [
        "direct_spec_citation",
        "source_integrity",
        "human_review_for_authority"
      ]
    },
    {
      "agent_id": "C08",
      "agent_class": "control",
      "modules": [
        "COM-01",
        "COM-02",
        "COM-04",
        "COM-05",
        "COM-06",
        "COM-07",
        "COM-08",
        "COM-09",
        "COM-10"
      ],
      "operating_mode": "evidence_first",
      "mandatory_gates": [
        "direct_spec_citation",
        "source_integrity",
        "human_review_for_authority"
      ]
    },
    {
      "agent_id": "ACQ.4",
      "agent_class": "process_auditor",
      "modules": [
        "COM-01",
        "COM-02",
        "COM-04",
        "COM-05",
        "COM-06",
        "COM-07",
        "COM-08",
        "COM-09",
        "COM-10"
      ],
      "operating_mode": "normative_check_plus_contextual_analysis",
      "emphasis": "scope, evidence quality, prioritization, cross-party responsibility, baseline continuity and corrective action",
      "mandatory_gates": [
        "direct_spec_citation",
        "scope_status",
        "unknown_and_conflict_preservation",
        "technical_human_review"
      ]
    },
    {
      "agent_id": "SPL.2",
      "agent_class": "process_auditor",
      "modules": [
        "COM-01",
        "COM-02",
        "COM-04",
        "COM-05",
        "COM-06",
        "COM-07",
        "COM-08",
        "COM-09",
        "COM-10"
      ],
      "operating_mode": "normative_check_plus_contextual_analysis",
      "emphasis": "scope, evidence quality, prioritization, cross-party responsibility, baseline continuity and corrective action",
      "mandatory_gates": [
        "direct_spec_citation",
        "scope_status",
        "unknown_and_conflict_preservation",
        "technical_human_review"
      ]
    },
    {
      "agent_id": "SYS.1",
      "agent_class": "process_auditor",
      "modules": [
        "COM-01",
        "COM-02",
        "COM-03",
        "COM-05",
        "COM-06",
        "COM-07",
        "COM-09"
      ],
      "operating_mode": "normative_check_plus_contextual_analysis",
      "emphasis": "bounded problem definition, evidence provenance, design assumptions, interface communication and cross-level consistency",
      "mandatory_gates": [
        "direct_spec_citation",
        "scope_status",
        "unknown_and_conflict_preservation",
        "technical_human_review"
      ]
    },
    {
      "agent_id": "SYS.2",
      "agent_class": "process_auditor",
      "modules": [
        "COM-01",
        "COM-02",
        "COM-03",
        "COM-05",
        "COM-06",
        "COM-07",
        "COM-09"
      ],
      "operating_mode": "normative_check_plus_contextual_analysis",
      "emphasis": "bounded problem definition, evidence provenance, design assumptions, interface communication and cross-level consistency",
      "mandatory_gates": [
        "direct_spec_citation",
        "scope_status",
        "unknown_and_conflict_preservation",
        "technical_human_review"
      ]
    },
    {
      "agent_id": "SYS.3",
      "agent_class": "process_auditor",
      "modules": [
        "COM-01",
        "COM-02",
        "COM-03",
        "COM-05",
        "COM-06",
        "COM-07",
        "COM-09"
      ],
      "operating_mode": "normative_check_plus_contextual_analysis",
      "emphasis": "bounded problem definition, evidence provenance, design assumptions, interface communication and cross-level consistency",
      "mandatory_gates": [
        "direct_spec_citation",
        "scope_status",
        "unknown_and_conflict_preservation",
        "technical_human_review"
      ]
    },
    {
      "agent_id": "SYS.4",
      "agent_class": "process_auditor",
      "modules": [
        "COM-01",
        "COM-02",
        "COM-03",
        "COM-05",
        "COM-06",
        "COM-07",
        "COM-09",
        "COM-10"
      ],
      "operating_mode": "normative_check_plus_contextual_analysis",
      "emphasis": "testable hypotheses, controlled measures, result interpretation, regression impact and independent review",
      "mandatory_gates": [
        "direct_spec_citation",
        "scope_status",
        "unknown_and_conflict_preservation",
        "technical_human_review"
      ]
    },
    {
      "agent_id": "SYS.5",
      "agent_class": "process_auditor",
      "modules": [
        "COM-01",
        "COM-02",
        "COM-03",
        "COM-05",
        "COM-06",
        "COM-07",
        "COM-09",
        "COM-10"
      ],
      "operating_mode": "normative_check_plus_contextual_analysis",
      "emphasis": "testable hypotheses, controlled measures, result interpretation, regression impact and independent review",
      "mandatory_gates": [
        "direct_spec_citation",
        "scope_status",
        "unknown_and_conflict_preservation",
        "technical_human_review"
      ]
    },
    {
      "agent_id": "SWE.1",
      "agent_class": "process_auditor",
      "modules": [
        "COM-01",
        "COM-02",
        "COM-03",
        "COM-05",
        "COM-06",
        "COM-07",
        "COM-09"
      ],
      "operating_mode": "normative_check_plus_contextual_analysis",
      "emphasis": "bounded problem definition, evidence provenance, design assumptions, interface communication and cross-level consistency",
      "mandatory_gates": [
        "direct_spec_citation",
        "scope_status",
        "unknown_and_conflict_preservation",
        "technical_human_review"
      ]
    },
    {
      "agent_id": "SWE.2",
      "agent_class": "process_auditor",
      "modules": [
        "COM-01",
        "COM-02",
        "COM-03",
        "COM-05",
        "COM-06",
        "COM-07",
        "COM-09"
      ],
      "operating_mode": "normative_check_plus_contextual_analysis",
      "emphasis": "bounded problem definition, evidence provenance, design assumptions, interface communication and cross-level consistency",
      "mandatory_gates": [
        "direct_spec_citation",
        "scope_status",
        "unknown_and_conflict_preservation",
        "technical_human_review"
      ]
    },
    {
      "agent_id": "SWE.3",
      "agent_class": "process_auditor",
      "modules": [
        "COM-01",
        "COM-02",
        "COM-03",
        "COM-05",
        "COM-06",
        "COM-07",
        "COM-09"
      ],
      "operating_mode": "normative_check_plus_contextual_analysis",
      "emphasis": "bounded problem definition, evidence provenance, design assumptions, interface communication and cross-level consistency",
      "mandatory_gates": [
        "direct_spec_citation",
        "scope_status",
        "unknown_and_conflict_preservation",
        "technical_human_review"
      ]
    },
    {
      "agent_id": "SWE.4",
      "agent_class": "process_auditor",
      "modules": [
        "COM-01",
        "COM-02",
        "COM-03",
        "COM-05",
        "COM-06",
        "COM-07",
        "COM-09",
        "COM-10"
      ],
      "operating_mode": "normative_check_plus_contextual_analysis",
      "emphasis": "testable hypotheses, controlled measures, result interpretation, regression impact and independent review",
      "mandatory_gates": [